<?xml version="1.0" encoding="UTF-8"?>

<CATALOG
    xmlns:xsi="http://www.w3.org/2001/XMLSchema"
    xsi:noNamespaceSchemaLocation="botanica.xsd">
    <PLANT>
        <COMMON>Bloodroot</COMMON>
        <BOTANICAL>Sanguinaria canadensis</BOTANICAL>
        <ZONE>4</ZONE>
        <LIGHT>Mostly Shady</LIGHT>
        <PRICE CURRENCY="USD">2.44</PRICE>
    </PLANT>
    <PLANT>
        <COMMON>Columbine</COMMON>
        <BOTANICAL>Aquilegia canadensis</BOTANICAL>
        <ZONE>3</ZONE>
        <LIGHT>Mostly Shady</LIGHT>
        <PRICE CURRENCY="USD">9.37</PRICE>
    </PLANT>
    <PLANT>
        <COMMON>Marsh Marigold</COMMON>
        <BOTANICAL>Caltha palustris</BOTANICAL>
        <ZONE>4</ZONE>
        <LIGHT>Mostly Sunny</LIGHT>
        <PRICE CURRENCY="EURO">6.81</PRICE>
    </PLANT>
</CATALOG>